{
  "topic_slug": "777-partners-founder-guilty-500m-fraud",
  "strongest_angle": "Josh Wander, co-founder of 777 Partners, pleaded guilty in Manhattan federal court to wire fraud and securities fraud in connection with a $500 million financial scheme.",
  "key_facts": [
    {
      "fact": "Josh Wander, co-founder of Miami-based 777 Partners, pleaded guilty in Manhattan federal court to wire fraud and securities fraud involving at least $500 million in losses.",
      "source_url": "https://apnews.com/article/soccer-777-wander-plea-4c379173faf770c816d51561afdc662e",
      "source_name": "Associated Press",
      "confidence": "high"
    },
    {
      "fact": "Federal prosecutors in the Southern District of New York charged Joshua Wander with orchestrating a scheme to bilk lenders and investors out of $500 million before the firm collapsed.",
      "source_url": "https://www.justice.gov/usao-sdny/pr/founder-and-former-ceo-777-partners-pleads-guilty-500-million-fraud-scheme",
      "source_name": "United States Department of Justice",
      "confidence": "high"
    },
    {
      "fact": "Josh Wander, aged 45, admitted to fraud in connection with the multi-layered financial scheme involving 777 Partners.",
      "source_url": "https://news.bloomberglaw.com/bankruptcy-law/777-partners-co-founder-wander-pleads-guilty-to-fraud",
      "source_name": "Bloomberg Law",
      "confidence": "high"
    }
  ],
  "numbers": [
    {
      "label": "Fraud scheme losses",
      "value": 500,
      "unit": "million dollars",
      "source_url": "https://apnews.com/article/soccer-777-wander-plea-4c379173faf770c816d51561afdc662e"
    },
    {
      "label": "Josh Wander age",
      "value": 45,
      "unit": "years",
      "source_url": "https://apnews.com/article/soccer-777-wander-plea-4c379173faf770c816d51561afdc662e"
    }
  ],
  "quotes": [],
  "named_entities": [
    {
      "name": "Josh Wander",
      "kind": "person"
    },
    {
      "name": "777 Partners",
      "kind": "organization"
    },
    {
      "name": "Manhattan",
      "kind": "place"
    },
    {
      "name": "Miami",
      "kind": "place"
    },
    {
      "name": "United States Department of Justice",
      "kind": "organization"
    }
  ]
}
