{
  "topic_slug": "cia-officer-david-rush-40m-fraud-scheme",
  "strongest_angle": "David Rush's massive financial fraud within the CIA and his plea of guilty to $195 million fraud involving gold bars.",
  "key_facts": [
    {
      "fact": "David Rush admitted to pulling off a major scheme, likely the largest financial fraud by a single member of the spy agency.",
      "source_url": "https://www.nbcnews.com/politics/national-security/perplexing-case-cia-officer-duped-fellow-spies-rcna602375",
      "source_name": "NBC News",
      "confidence": "high"
    },
    {
      "fact": "David J. Rush pleaded guilty to a $195 million fraud involving gold bars and real estate.",
      "source_url": "https://www.washingtonpost.com/national-security/2026/10/06/ex-cia-official-expected-plead-guilty-40-million-gold-bar-case",
      "source_name": "The Washington Post",
      "confidence": "high"
    },
    {
      "fact": "David Rush was found with hundreds of gold bars in his home, admitting to a $200 million scam involving fake contracts and real estate.",
      "source_url": "https://www.bbc.com/news/articles/cr3wvq965dngo",
      "source_name": "BBC News",
      "confidence": "high"
    }
  ],
  "numbers": [
    {
      "label": "Gold Bars",
      "value": 400,
      "unit": "pieces",
      "source_url": "https://www.bbc.com/news/articles/cr3wvq965dngo"
    },
    {
      "label": "Gold Value",
      "value": 195000000,
      "unit": "dollars",
      "source_url": "https://www.washingtonpost.com/national-security/2026/10/06/ex-cia-official-expected-plead-guilty-40-million-gold-bar-case"
    },
    {
      "label": "Total Fraud",
      "value": 200000000,
      "unit": "dollars",
      "source_url": "https://www.bbc.com/news/articles/cr3wvq965dngo"
    }
  ],
  "named_entities": [
    {
      "name": "David Rush",
      "kind": "person"
    },
    {
      "name": "Washingtion",
      "kind": "place"
    },
    {
      "name": "Virginia",
      "kind": "place"
    },
    {
      "name": "Alexandria",
      "kind": "place"
    },
    {
      "name": "CIA",
      "kind": "organization"
    },
    {
      "name": "Gold Bars",
      "kind": "object"
    }
  ],
  "quotes": [
    {
      "text": "David Rush admitted to pulling off a major scheme. It was likely the largest financial fraud ever committed by a single member of the spy agency, officials said.",
      "speaker": "Dan De Luce",
      "source_name": "NBC News",
      "source_url": "https://www.nbcnews.com/politics/national-security/perplexing-case-cia-officer-duped-fellow-spies-rcna602375"
    },
    {
      "text": "David J. Rush also revealed the existence of a confidential asset to a foreign government official.",
      "speaker": "Salvador Rizzo",
      "source_name": "The Washington Post",
      "source_url": "https://www.washingtonpost.com/national-security/2026/10/06/ex-cia-official-expected-plead-guilty-40-million-gold-bar-case"
    },
    {
      "text": "David Rush, 49, is required to pay restitution to the US government.",
      "speaker": "Devlin Barrett",
      "source_name": "The New York Times",
      "source_url": "https://www.nytimes.com/2026/10/06/us/politics/cia-officer-gold-bars-guilty-plea.html"
    }
  ]
}
